{
  "fixture_version": 1,
  "repository": "corpus-nz-hansard",
  "reviewed_at": "2026-06-10",
  "samples": [
    {
      "sample_id": "gold-member-resolution-01",
      "domain": "member_resolution",
      "example_class": "positive",
      "target_component_type": "member",
      "target_component_id": "member-raw-clayton-cosgrove",
      "source_reference": {
        "release_version": "0.1.0",
        "parliament_number": 47,
        "document_type": "Hansard - speech",
        "source_file": "2024-09-06 Hansard Extract from DocumentsDB/Hansard-47.csv",
        "source_row_number": null,
        "parliament_document_id": "47HansD_20031112_00001051"
      },
      "text_excerpt": "CLAYTON COSGROVE: The second is a certificate of incorporation...",
      "label": {
        "status": "gold_positive",
        "value": "CLAYTON COSGROVE",
        "expected_behavior": "A resolver may emit a candidate member match for the explicit speaker string, with authority-source validation still required before publication.",
        "label_provenance": ["manifests/speech_turn_segmentation_validation.json", "manifests/authority_sources.json"]
      },
      "sampling_frame": "Explicit uppercase speaker candidate from existing speech-turn validation examples.",
      "review": {
        "review_status": "reviewed",
        "reviewer": "repository-maintainer",
        "reviewed_at": "2026-06-10",
        "review_method": "Manual fixture review against tracked validation example; no automated model label accepted as gold.",
        "model_generated_label": false
      }
    },
    {
      "sample_id": "gold-member-resolution-02",
      "domain": "member_resolution",
      "example_class": "negative",
      "target_component_type": "member",
      "target_component_id": null,
      "source_reference": {
        "release_version": "0.1.0",
        "parliament_number": 47,
        "document_type": "Hansard - debate",
        "source_file": "2024-09-06 Hansard Extract from DocumentsDB/Hansard-47.csv",
        "source_row_number": null,
        "parliament_document_id": "47HansD_20030408"
      },
      "text_excerpt": "Minister of Consumer Affairs: I move",
      "label": {
        "status": "gold_negative",
        "value": null,
        "expected_behavior": "Do not resolve an office title to a member identity without a dated authority source.",
        "label_provenance": ["docs/component-contracts.md", "manifests/authority_sources.json"]
      },
      "sampling_frame": "Office-title speaker candidate from existing speech-turn validation examples.",
      "review": {
        "review_status": "reviewed",
        "reviewer": "repository-maintainer",
        "reviewed_at": "2026-06-10",
        "review_method": "Manual fixture review of role-title boundary.",
        "model_generated_label": false
      }
    },
    {
      "sample_id": "gold-member-resolution-03",
      "domain": "member_resolution",
      "example_class": "ambiguous",
      "target_component_type": "member",
      "target_component_id": null,
      "source_reference": {
        "release_version": "0.1.0",
        "parliament_number": 47,
        "document_type": "Hansard - speech",
        "source_file": "2024-09-06 Hansard Extract from DocumentsDB/Hansard-47.csv",
        "source_row_number": null,
        "parliament_document_id": "47HansS_20031210_00001051"
      },
      "text_excerpt": "Hon Roger Sowry: I raise a point of order...",
      "label": {
        "status": "gold_ambiguous",
        "value": "Hon Roger Sowry",
        "expected_behavior": "Preserve honorific and name variant evidence; require authority matching before canonical member_id publication.",
        "label_provenance": ["manifests/speech_turn_segmentation_validation.json", "manifests/authority_sources.json"]
      },
      "sampling_frame": "Honorific name variant from existing speech-turn validation examples.",
      "review": {
        "review_status": "reviewed",
        "reviewer": "repository-maintainer",
        "reviewed_at": "2026-06-10",
        "review_method": "Manual ambiguity review of raw speaker variant.",
        "model_generated_label": false
      }
    },
    {
      "sample_id": "gold-member-resolution-04",
      "domain": "member_resolution",
      "example_class": "unresolved",
      "target_component_type": "member",
      "target_component_id": null,
      "source_reference": {
        "release_version": "0.1.0",
        "parliament_number": 47,
        "document_type": "Hansard - debate",
        "source_file": "2024-09-06 Hansard Extract from DocumentsDB/Hansard-47.csv",
        "source_row_number": null,
        "parliament_document_id": "47HansD_20040908_00000864"
      },
      "text_excerpt": "Counting for Something: Value Added By Voluntary Agencies",
      "label": {
        "status": "gold_unresolved",
        "value": null,
        "expected_behavior": "Leave unresolved because the candidate text is a heading-like phrase, not a clear member name.",
        "label_provenance": ["manifests/speech_turn_segmentation_validation.json"]
      },
      "sampling_frame": "Heading-like speaker candidate from existing speech-turn validation examples.",
      "review": {
        "review_status": "reviewed",
        "reviewer": "repository-maintainer",
        "reviewed_at": "2026-06-10",
        "review_method": "Manual unresolved-case review.",
        "model_generated_label": false
      }
    },
    {
      "sample_id": "gold-member-resolution-05",
      "domain": "member_resolution",
      "example_class": "excluded",
      "target_component_type": "member",
      "target_component_id": null,
      "source_reference": {
        "release_version": "0.1.0",
        "parliament_number": 47,
        "document_type": "Hansard - daily",
        "source_file": "2024-09-06 Hansard Extract from DocumentsDB/Hansard-47.csv",
        "source_row_number": null,
        "parliament_document_id": "47HansD_20041005"
      },
      "text_excerpt": "Hansard",
      "label": {
        "status": "gold_excluded",
        "value": null,
        "expected_behavior": "Exclude generic publication headings from member-resolution metrics.",
        "label_provenance": ["docs/component-contracts.md"]
      },
      "sampling_frame": "Generic heading candidate from existing speech-turn validation examples.",
      "review": {
        "review_status": "reviewed",
        "reviewer": "repository-maintainer",
        "reviewed_at": "2026-06-10",
        "review_method": "Manual exclusion review.",
        "model_generated_label": false
      }
    },
    {
      "sample_id": "gold-party-attribution-01",
      "domain": "party_attribution",
      "example_class": "positive",
      "target_component_type": "party_vote",
      "target_component_id": "party-vote-new-zealand-labour",
      "source_reference": {
        "release_version": "0.1.0",
        "parliament_number": 51,
        "document_type": "Hansard - vote",
        "source_file": "2024-09-06 Hansard Extract from DocumentsDB/Hansard-51.csv",
        "source_row_number": null,
        "parliament_document_id": null
      },
      "text_excerpt": "Ayes 93 New Zealand National 59; New Zealand Labour 30; Maori Party 2; ACT New Zealand 1; United Future 1.",
      "label": {
        "status": "gold_positive",
        "value": "New Zealand Labour",
        "expected_behavior": "Recognise explicit party labels inside a party-vote text span while preserving vote-event provenance.",
        "label_provenance": ["manifests/schema_discovery.json", "docs/component-contracts.md"]
      },
      "sampling_frame": "Party-label text in sampled vote content.",
      "review": {
        "review_status": "reviewed",
        "reviewer": "repository-maintainer",
        "reviewed_at": "2026-06-10",
        "review_method": "Manual review of explicit party label in tracked schema-discovery sample.",
        "model_generated_label": false
      }
    },
    {
      "sample_id": "gold-party-attribution-02",
      "domain": "party_attribution",
      "example_class": "negative",
      "target_component_type": "party_membership",
      "target_component_id": null,
      "source_reference": {
        "release_version": "0.1.0",
        "parliament_number": 47,
        "document_type": "Hansard - speech",
        "source_file": "2024-09-06 Hansard Extract from DocumentsDB/Hansard-47.csv",
        "source_row_number": null,
        "parliament_document_id": "47HansD_20031112_00001051"
      },
      "text_excerpt": "CLAYTON COSGROVE: The second is a certificate of incorporation...",
      "label": {
        "status": "gold_negative",
        "value": null,
        "expected_behavior": "Do not infer party membership from a raw speaker name alone.",
        "label_provenance": ["docs/component-contracts.md", "conductor/tracks/party_attribution_provenance_20260609/spec.md"]
      },
      "sampling_frame": "Speaker-name case without party authority evidence.",
      "review": {
        "review_status": "reviewed",
        "reviewer": "repository-maintainer",
        "reviewed_at": "2026-06-10",
        "review_method": "Manual review of no-party-source boundary.",
        "model_generated_label": false
      }
    },
    {
      "sample_id": "gold-party-attribution-03",
      "domain": "party_attribution",
      "example_class": "ambiguous",
      "target_component_type": "party_vote",
      "target_component_id": "party-vote-green-alias",
      "source_reference": {
        "release_version": "0.1.0",
        "parliament_number": 54,
        "document_type": "Hansard - vote",
        "source_file": "2024-09-06 Hansard Extract from DocumentsDB/Hansard-54.csv",
        "source_row_number": null,
        "parliament_document_id": "HansS_20240625_067140000"
      },
      "text_excerpt": "Noes 48 New Zealand Labour 34; Green Party of Aotearoa New Zealand 14.",
      "label": {
        "status": "gold_ambiguous",
        "value": "Green Party of Aotearoa New Zealand",